{
  "$schema": "https://json-schema.org/draft/2020-12/schema",
  "title": "4VRS snapshot v1 (20-card capability)",
  "type": "object",
  "additionalProperties": false,
  "required": [
    "schema",
    "key",
    "session",
    "seq",
    "ttl_s",
    "cards"
  ],
  "properties": {
    "schema": {
      "const": 1,
      "type": "integer"
    },
    "key": {
      "type": "string",
      "pattern": "^[0-9a-f]{32}$"
    },
    "session": {
      "type": "string",
      "pattern": "^[0-9a-f]{32}$"
    },
    "seq": {
      "type": "integer",
      "minimum": 1,
      "maximum": 4294967295
    },
    "ttl_s": {
      "type": "integer",
      "minimum": 30,
      "maximum": 300
    },
    "cards": {
      "type": "array",
      "minItems": 0,
      "maxItems": 20,
      "items": {
        "type": "object",
        "additionalProperties": false,
        "required": [
          "id",
          "name",
          "kind",
          "state",
          "unit"
        ],
        "properties": {
          "id": {
            "type": "string",
            "maxLength": 96,
            "pattern": "^[a-z][a-z0-9_]*\\.[a-z0-9_]+$"
          },
          "name": {
            "type": "string",
            "minLength": 1,
            "maxLength": 96,
            "x-maxUtf8Bytes": 96
          },
          "kind": {
            "enum": [
              "fan",
              "light",
              "valve",
              "sensor",
              "binary_sensor",
              "switch",
              "text"
            ]
          },
          "state": {
            "type": "string",
            "minLength": 1,
            "maxLength": 96,
            "x-maxUtf8Bytes": 96
          },
          "unit": {
            "type": "string",
            "maxLength": 16,
            "x-maxUtf8Bytes": 16
          },
          "icon": {
            "type": "string",
            "enum": [
              "air",
              "battery",
              "binary_sensor",
              "button",
              "camera",
              "clock",
              "door",
              "event",
              "fan",
              "gas",
              "group",
              "humidity",
              "image",
              "leak",
              "light",
              "list",
              "location",
              "lock",
              "media",
              "money",
              "motion",
              "network",
              "person",
              "plug",
              "power",
              "pressure",
              "remote",
              "robot",
              "ruler",
              "sensor",
              "settings",
              "shield",
              "smoke",
              "sound",
              "storage",
              "sun",
              "switch",
              "temperature",
              "text",
              "update",
              "valve",
              "warning",
              "water",
              "weather",
              "wind",
              "window"
            ]
          },
          "alert": {
            "type": "boolean"
          },
          "area": {
            "type": "string",
            "maxLength": 48,
            "x-maxUtf8Bytes": 48,
            "description": "Optional HA area name; empty means unassigned. Send only when area_v=1 and max_payload>=9216."
          },
          "area_icon": {
            "type": "string",
            "enum": [
              "room",
              "toilet",
              "bathroom",
              "kitchen",
              "bedroom",
              "living",
              "garage",
              "office",
              "server",
              "balcony",
              "hall",
              "garden",
              "laundry",
              "storage",
              "kids"
            ],
            "description": "Optional room pictogram, negotiated with area_icon_v=1; requires area."
          }
        },
        "dependentRequired": {
          "area_icon": [
            "area"
          ]
        }
      }
    }
  }
}
